{"authorities":[{"authorityClass":"evaluation_policy","mediaType":"application/vnd.rawframe.evidence.evaluation-policy.v1+json","path":"evidence/policies/tier0-evaluation-policy-v1.json"},{"authorityClass":"metric_registry","mediaType":"application/vnd.rawframe.evidence.metric-registry.v1+json","path":"evidence/registries/metric-registry-v1.json"}],"indexGeneration":1,"recordKind":"evidence_index","schemaVersion":1}